[
  {
    "id": "018f5a00-0000-7000-8000-000000000101",
    "tenant_id": "eko",
    "type": "LHO",
    "parent_id": null,
    "name": "Bihar LHO - Patna",
    "code": "LHO-BR-01",
    "address": "West Gandhi Maidan, Patna",
    "state": "Bihar",
    "district": "Patna",
    "pin_code": "800001",
    "coordinates": { "lat": 25.6127, "lng": 85.1414 },
    "radius_m": 200,
    "coordinate_confidence": "VERIFIED",
    "status": "ACTIVE",
    "updated_at": "2026-06-01T04:30:00Z"
  },
  {
    "id": "018f5a00-0000-7000-8000-000000000102",
    "tenant_id": "eko",
    "type": "RBO",
    "parent_id": "018f5a00-0000-7000-8000-000000000101",
    "name": "RBO Nandpur",
    "code": "RBO-ND-01",
    "address": "Station Road, Nandpur",
    "state": "Bihar",
    "district": "Nandpur",
    "pin_code": "841501",
    "coordinates": { "lat": 25.35, "lng": 85.75 },
    "radius_m": 150,
    "coordinate_confidence": "VERIFIED",
    "status": "ACTIVE",
    "updated_at": "2026-06-01T04:31:00Z"
  },
  {
    "id": "018f5a00-0000-7000-8000-000000000103",
    "tenant_id": "eko",
    "type": "BRANCH",
    "parent_id": "018f5a00-0000-7000-8000-000000000102",
    "name": "Nandpur Bazar Branch",
    "code": "BR-ND-001",
    "address": "Main Bazar, Nandpur",
    "state": "Bihar",
    "district": "Nandpur",
    "pin_code": "841501",
    "coordinates": { "lat": 25.3548, "lng": 85.7552 },
    "radius_m": 120,
    "coordinate_confidence": "VERIFIED",
    "status": "ACTIVE",
    "updated_at": "2026-06-01T04:32:00Z"
  },
  {
    "id": "018f5a00-0000-7000-8000-000000000104",
    "tenant_id": "eko",
    "type": "BRANCH",
    "parent_id": "018f5a00-0000-7000-8000-000000000102",
    "name": "Nandpur Rural Branch",
    "code": "BR-ND-002",
    "address": "Block Road, Nandpur Rural",
    "state": "Bihar",
    "district": "Nandpur",
    "pin_code": "841502",
    "coordinates": { "lat": 25.3002, "lng": 85.8005 },
    "radius_m": 150,
    "coordinate_confidence": "FIELD_CAPTURED",
    "status": "ACTIVE",
    "updated_at": "2026-06-01T04:33:00Z"
  },
  {
    "id": "018f5a00-0000-7000-8000-000000000105",
    "tenant_id": "eko",
    "type": "CSP",
    "parent_id": "018f5a00-0000-7000-8000-000000000103",
    "name": "CSP Kishanganj Chowk",
    "code": "CSP-ND-1001",
    "address": "Kishanganj Chowk, Nandpur",
    "state": "Bihar",
    "district": "Nandpur",
    "pin_code": "841501",
    "coordinates": { "lat": 25.3602, "lng": 85.7591 },
    "radius_m": 100,
    "coordinate_confidence": "FIELD_CAPTURED",
    "status": "ACTIVE",
    "updated_at": "2026-06-01T04:34:00Z"
  },
  {
    "id": "018f5a00-0000-7000-8000-000000000106",
    "tenant_id": "eko",
    "type": "CSP",
    "parent_id": "018f5a00-0000-7000-8000-000000000103",
    "name": "CSP Mahua Tola",
    "code": "CSP-ND-1002",
    "address": "Mahua Tola, Nandpur",
    "state": "Bihar",
    "district": "Nandpur",
    "pin_code": "841501",
    "coordinates": { "lat": 25.3721, "lng": 85.7488 },
    "radius_m": 120,
    "coordinate_confidence": "VERIFIED",
    "status": "ACTIVE",
    "updated_at": "2026-06-01T04:35:00Z"
  },
  {
    "id": "018f5a00-0000-7000-8000-000000000107",
    "tenant_id": "eko",
    "type": "CSP",
    "parent_id": "018f5a00-0000-7000-8000-000000000104",
    "name": "CSP Baniya Ghat",
    "code": "CSP-ND-1003",
    "address": "Baniya Ghat, Nandpur Rural",
    "state": "Bihar",
    "district": "Nandpur",
    "pin_code": "841502",
    "coordinates": { "lat": 25.2955, "lng": 85.8103 },
    "radius_m": 150,
    "coordinate_confidence": "FIELD_CAPTURED",
    "status": "ACTIVE",
    "updated_at": "2026-06-01T04:36:00Z"
  },
  {
    "id": "018f5a00-0000-7000-8000-000000000108",
    "tenant_id": "eko",
    "type": "CSP",
    "parent_id": "018f5a00-0000-7000-8000-000000000104",
    "name": "CSP Sonpur Diara",
    "code": "CSP-ND-1004",
    "address": "Sonpur Diara, Nandpur Rural",
    "state": "Bihar",
    "district": "Nandpur",
    "pin_code": "841502",
    "coordinates": { "lat": 25.281, "lng": 85.8322 },
    "radius_m": 200,
    "coordinate_confidence": "VERIFIED",
    "status": "ACTIVE",
    "updated_at": "2026-06-01T04:37:00Z"
  },
  {
    "id": "018f5a00-0000-7000-8000-000000000109",
    "tenant_id": "eko",
    "type": "CSP",
    "parent_id": "018f5a00-0000-7000-8000-000000000104",
    "name": "CSP Rampur Khajuria",
    "code": "CSP-ND-1005",
    "address": "Rampur Khajuria, Nandpur Rural",
    "state": "Bihar",
    "district": "Nandpur",
    "pin_code": "841502",
    "coordinates": { "lat": 25.2688, "lng": 85.8455 },
    "radius_m": 120,
    "coordinate_confidence": "UNVERIFIED",
    "status": "ACTIVE",
    "updated_at": "2026-06-01T04:38:00Z"
  }
]
